{
  "name": "get-design-done",
  "owner": {
    "name": "hegemonart"
  },
  "metadata": {
    "description": "Get Design Done — 5-stage agent-orchestrated design pipeline with 9 connections, handoff-first workflow, bidirectional Figma write-back, 22+ specialized agents, queryable knowledge layer (intel store, dependency analysis, learnings extraction), and a self-improvement loop (reflector, frontmatter + budget feedback, global-skills layer). v1.20.0 ships the SDK foundation: gdd-state MCP server (11 typed tools), lockfile-safe STATE.md mutations, event stream, and resilience primitives (jittered-backoff, rate-guard, error-classifier, iteration-budget) for rate-limit + 429 + context-overflow recovery. Full CI/CD pipeline (Node 22/24 × Linux/macOS/Windows) and release automation (auto-tag + GitHub Release + release-time smoke test).",
    "version": "1.39.2"
  },
  "plugins": [
    {
      "name": "get-design-done",
      "source": "./",
      "description": "Agent-orchestrated 5-stage design pipeline: Brief → Explore → Plan → Design → Verify. 22+ specialized agents, 9 connections (Figma, Refero, Preview, Storybook, Chromatic, Figma Writer, Graphify, Pinterest, Claude Design), Claude Design handoff, bidirectional Figma write-back, and a queryable intel store (.design/intel/) for dependency and learnings queries. Standalone commands: style, darkmode, compare, figma-write, graphify, handoff, analyze-dependencies, skill-manifest, extract-learnings. Embeds NNG heuristics, WCAG thresholds, typographic systems, motion framework, and anti-pattern catalog. Ships with a full CI/CD pipeline (Node 22/24 × Linux/macOS/Windows) and release automation. Optimization layer (v1.0.4.1, retroactive): gdd-router + gdd-cache-manager skills, PreToolUse budget-enforcer hook, tier-aware agent frontmatter, lazy checker gates, streaming synthesizer, /gdd:warm-cache + /gdd:optimize commands, and cost telemetry at .design/telemetry/costs.jsonl — targeting 50-70% per-task token-cost reduction with no quality-floor regression. v1.20.0 SDK foundation: gdd-state MCP server (11 typed tools), lockfile-safe STATE.md mutations, event stream at .design/telemetry/events.jsonl, resilience primitives (jittered-backoff, rate-guard, error-classifier, iteration-budget) with rate-limit + 429 + context-overflow recovery, and TypeScript toolchain.",
      "version": "1.39.2",
      "author": {
        "name": "hegemonart"
      },
      "homepage": "https://github.com/hegemonart/get-design-done",
      "repository": "https://github.com/hegemonart/get-design-done",
      "license": "MIT",
      "category": "design",
      "keywords": [
        "design",
        "ui",
        "ux",
        "frontend",
        "pipeline",
        "orchestration",
        "skill",
        "design-system",
        "accessibility",
        "wcag",
        "nng",
        "typography",
        "motion",
        "anti-patterns",
        "audit",
        "visual-regression",
        "storybook",
        "graphify",
        "playwright",
        "figma-write",
        "handoff",
        "claude-design",
        "pinterest",
        "bidirectional",
        "knowledge-graph",
        "intel-store",
        "tested",
        "ci",
        "cicd",
        "release-automation",
        "gitleaks",
        "shellcheck",
        "safety-hardening",
        "protected-paths",
        "decision-injector",
        "reference-registry",
        "mcp-circuit-breaker",
        "schema-validation",
        "cost-optimization",
        "cache-aware",
        "budget",
        "headless",
        "cli",
        "codex",
        "gemini",
        "mcp",
        "parallel-agents",
        "agent-sdk",
        "figma",
        "extractor",
        "design-system-sync",
        "swift",
        "compose",
        "flutter",
        "email",
        "print",
        "pdf"
      ]
    }
  ]
}
